title,body,from_scratch,linear_algebra,deep_learning,tensorflow,statistics,machine_learning,analysis,probability_distribution
Word2vec from Scratch,"In a previous post, we discussed how we can use tf-idf vectorization to encode documents into vectors. While probing more into this topic and geting a taste of what NLP is like, I decided to take a jab at another closely related, classic topic in NLP: word2vec. word2vec is a technique introduced by Google engineers in 2013, popularized by statements such as “king - man + woman = queen.” The gist of it, as you may know, is that we can express words as vectors that encode their semantics in a meaningful way. When I was just getting starting to learn TensorFlow, I came across the embedding layer, which performed exactly this operation: transforming words into vectors. While I thought this process was extremely interesting, I didn’t know about the internals of this structure until today, particularly after reading this wonderful tutorial by Chris McCornick. In this post, we will be implementing word2vec, a popular embedding technique, from scratch with NumPy. Let’s get started! Instead of going over the concepts and implementations separately, let’s jump straight into the whole implementation process and elaborate on what is necessary along the way. In order to create word embeddings, we need some sort of data. Here is a text on machine learning from Wikipedia. I’ve removed some parentheses and citation brackets to make things slightly easier. Since we can’t feed raw string texts into our model, we will need to preprocess this text.",1,0,1,0,0,0,0,0
How lucky was I on my shift?,"Assuming independence on each coin toss, we can use multiplication to calculate this probability: Notice that  because we assumed the coin was fair. Had it not been fair, we would have different probabilities for  and , explained by the relationship that . This is what the binomial PMF is implying: calculating the probability that we get  successes in  trials requires that we multiply the probability of success  by  times and the probability of failure  by  times, because those are the numbers of successful and unsuccessful trials respectively. Now that we have reviewed the concept of binomial distribution, it is time to apply it to our example of phone calls at the Yongsan PMO. Although I do not have an  data sheet on me, let’s assume for the sake of convenience that, on average, 12 calls come to the PMO per shift, which is eight hours. Given this information, how can we simulate the situation as a binomial distribution? First, we have to define what constitutes a success in this situation. While there might be other ways to go about this agenda, the most straightforward approach would be to define a phone call as a success. This brings us to the next question: how many trials do we have? Here is where things get a bit more complicated—we don’t really have trials! Notice that this situation is somewhat distinct from coin tosses, as we do not have a clearly defined “trial” or an experiment.",0,0,0,0,1,0,0,1
On Expectations and Integrals,"Imagine this process as being similar to what we learn in Calculus 101, where integrals are visualized as an infinite sum of skinny rectangles as the limit approaches zero. Essentially, we are doing the same thing, except that now, the base of each rectangle is defined as the difference between  and  instead of  and  as is the case with the Riemann integral. Another way to look at this is to consider the integral as calculating the area beneath the curve represented by the parameterization . This connection becomes a bit more apparent if we consider the fact that the Riemann integral is calculating the area beneath the curve represented by . In other words, the Riemann-Stieltjes integral can be seen as dealing with a change of variables. You might be wondering why the Riemann-Stieltjes integral is necessary in the first place. After all, the definition of expectation we already know by heart should be enough, shouldn’t it? To answer this question, consider the following  function: This cumulative mass function is obviously discontinuous since it is a step-wise function. This also means that it is not differentiable; hence, we cannot use the definition of expectation that we already know. However, this does not mean that the random variable  does not have an expected value.",0,0,0,0,1,0,0,0
Likelihood and Probability,"“I think that’s very unlikely.” “No, you’re probably right.” These are just some of the many remarks we use in every day conversations to express our beliefs. Linguistically, words such as “probably” or “likely” serve to qualify the strength of our professed belief, that is, we express a degree of uncertainty involved with a given statement. In today’s post, I suggest that we scrutinize the concept of likelihood—what it is, how we calculate it, and most importantly, how different it is from probability. Although the vast majority of us tend to conflate likelihood and probability in daily conversations, mathematically speaking, these two are distinct concepts, though closely related. After concretizing this difference, we then move onto a discussion of maximum likelihood, which is a useful tool frequently employed in Bayesian statistics. Without further ado, let’s jump right in. As we have seen in an earlier post on Bayesian analysis, likelihood tells us—and pardon the circular definition here—how likely a certain parameter is given some data. In other words, the likelihood function answers the question: provided some list of observed or sampled data , what is the likelihood that our parameter of interest takes on a certain value ? One measurement we can use to answer this question is simply the probability density of the observed value of the random variable at that distribution. In mathematical notation, this idea might be transcribed as: At a glance, likelihood seems to equal probability—after all, that is what the equation (1) seems to suggest.",0,0,0,0,1,0,0,0
Building Neural Network From Scratch,"Welcome back to another episode of “From Scratch” series on this blog, where we explore various machine learning algorithms by hand-coding them from scratch. So far , we have looked at various machine learning models, such as kNN, logistic regression, and naive Bayes. Now is time for an exciting addition to this mix: neural networks. Around last year December, I bought my first book on deep learning, titled Deep Learning from Scratch,  by Saito Goki. It was a Korean translation of a book originally published in Japanese by O’Reilly Japan. Many bloggers recommended the book as the go-to introductory textbook on deep learning, some even going as far as to say that it is a must-have. After reading a few pages in, I could see why: as the title claimed, the author used only  to essentially recreate deep learning models, ranging from simple vanilla neural networks to convolutional neural networks. As someone who had just started to learn Python, following the book was a lot harder than expected, but it was a worthwhile read indeed. Inspired by that book, and in part in an attempt to test the knowledge I gained from having read that bok, I decided to implement my own rendition of a simple neural network supported by minibatch gradient descent. Let’s jump right into it. The default setup of my Jupyter Notebook, as always: Before we start building our model, we should first prepare some data.",1,1,1,0,0,0,0,0
A Simple Autocomplete Model,"Let’s perform a quick sanity check to see if the function works as expected. Specifying  to 60 means that each instance in the training data will be 60 consecutive characters sampled from the text data every  characters. The result tells us that we have a total of 200278 training instances, which is probably plenty to train, test, and validate our model. The result also tells us that there are 57 unique characters in the text data. Note that these unique characters not only include alphabets but also and other miscellaneous white spacing characters and punctuations. Let’s now design our model. Because there is obviously going to be sequential, temporal structure underlying the training data, we will use an LSTM layer, a type of advanced recurrent neural network we saw in the previous post. In fact, this is all we need, unless we want to create a deep neural network spanning multiple layers. However, training such a model would cost a lot of time and computational resource. For the sake of simplicity, we will build a simple model with a single LSTM layer. The output layer is going to be a dense layer with  number of neurons, activated with a softmax function. We can thus interpret the index of the biggest value of the final array to correspond to the most likely character. Below is a full plot of the model that shows the dimensions of the input and output tensors of all layers.",0,0,1,1,0,0,0,0
A Brief Introduction to Recurrent Neural Networks,"First, note that our model accepts input of size . The dimensionality of the output is a little more tricky because of the  option. What concatenate does is that it basically flattens all  number of outputs into a single list. In this case, because we set the option to , we get a flattened list containing , or 6400 elements. The main takeaway is that recurrent neural networks can be used to implement some sort of memory functionality, which is useful when dealing with datasets where there exists some sort of sequential structure. One way to implement memory is by using the output of the previous sequence to define a  variable, which is used to compute the next output as we have done above. Now let’s get down to business with the  API. Implementing a recurrent neural network is not so much different from building a simple feed forward or convolutional neural network: we simply import a RNN-specific layer and arrange these layers to construct a working model. Before we proceed any further, let’s first import all necessary dependencies for this tutorial. As with any tutorial, we need to start by loading and preprocessing data. Luckily, there isn’t going to be much preprocessing involved since we will be using a dataset available from the  library, the IMBD movie reviews dataset. The dataset contains 25,000 movie reviews from IMDB, labeled as either positive or negative. Each review is encoded as a sequence of integers according to a consistent encoding scheme.",0,0,1,1,0,0,0,0
Bayesian Linear Regression,"MAP versus MLE is a recurring theme that appears throughout the paradigmatic shift from frequentist to Bayesian, so it merits discussion. Now that we have a posterior distribution for  which we can work with, it’s time to derive the predictive distribution. We go about this by marginalizing  using the property of conditional probability, as illustrated below. This may seem like a lot, but most of it was simple calculation and distributing vectors over parentheses. It’s time to use the power of conjugacy again to extract a normal distribution out of the equation soup. Let’s complete the square of the exponent according to the Gaussian form after making the appropriate substitutions Again, observing this is not a straightforward process, especially if we had no idea what the final distribution is going to look like. However, given that the resulting predictive posterior will take a Gaussian form, we can backtrack using this knowledge to obtain the appropriate substitution parameters in (13). Continuing, where the last equality stands because we can pull out terms unrelated to  by considering them as constants. Why do we bother to pull out the exponent? This is because the integral of a probability density function evaluates to 1, leaving us only with the exponential term outside the integral. To proceed further from here, let’s take some time to zoom in on  for a second. Substituting , we get We can now plug this term back into (15) as shown below.",0,1,0,0,0,0,0,0
Building Neural Network From Scratch,"Recall that our neural network is structured as follows: The last layer is a softmax unit that receives input  to produce output . Our goal, then, is to compute the gradient where  and  each represent the values taken by the th and th neuron in layers  and , respectively. One point of caution is that it is important to consider whether  and  are equal, as this produces differences in the calculation of the gradient. First consider the case when : When : We see that the gradient is different in the two cases! This is certainly going to important for us when calculating the gradient of , the cross entropy loss function, with respect to . Specifically, we have to consider the two cases separately by dividing up the summation expression into two parts, as shown below: That was a long ride, but in the end, we end up with a very nice expression! This tells us that the gradient of the cross entropy loss function with respect to the second affine layer is simply the size of the error term. In other words, if we expand the result in (13) to apply to the entire matrix of layers, we get This provides a great place for us to start. We can commence from here to find the gradient of the loss function with respect to other layers more further down the neural network.",1,1,1,0,0,0,0,0
The Magic of Euler’s Identity,"It is also interesting to see that the Taylor series for  is an odd function, while that for  is even, which is coherent with the features of their respective original functions. Last but not least, notice that the derivative of Taylor polynomial of  gives itself, as it should. Now that we have the Taylor polynomials, proving Euler’s identity becomes a straightforward process of plug and play. Let’s plug  into the Taylor polynomial for : Notice that we can separate the terrms with and without : In short, ! With this generalized equation in hand, we can plug in  into  to see Euler’s identity: The classic proof, although fairly straightforward, is not my favorite mode of proving Euler’s identity because it does not reveal any properties about the exponentiation of an imaginary number, or an irrational number for that matter. Instead, I found geometric interpretations of Euler’s formula to be more intuitive and thought-provoking. Below is a version of a proof for Euler’s identity. Let’s start by considering the complex plane. There are two ways of expressing complex numbers on the Argand diagram: points and vectors. One advantage of the vector approach over point representation is that we can borrow some simple concepts from physics to visualize  through the former: namely, a trajectory of a point moving along the complex plane with respect to some time parameter .",0,0,0,0,0,0,1,0
"Newton-Raphson, Secant, and More","7 is a familiar value, and indeed it is what was returned by the Newton-Raphson method as well. We confirm that this is indeed the root of the equation. Now that we have looked at both methods, it’s time to make a quick comparison. We will be comparing three different methods: By setting  to be , we can obtain a full list of root updates as the three methods begin their quest for the root of the function. We can then see which method converges the quickest. Let’s see how this little experiment turns out. We first begin by importing some dependencies to plot the history of values. Then, we obtain the history for each of the three approaches and plot them as a scatter plot. The result is shown below.  You might have to squint your eye to see that  (Netwon-Raphson with direct derivatives) and  (Newton-Raphson with center divided difference) almost coincide exactly at the same points. I was honestly somewhat surprised by the result: although we had verified the advantage of using center divided difference over forward or backward divided difference via some simple big-O analysis with trailing error terms, I did not expect the two to coincide with such exactitude. Another interesting observation is that the secant method seems to take slightly longer than the Newton-Raphson method. This is probably due to the fact that the secant method uses backward divided difference, and also the fact that it requires two previous at each iteration instead of one.",0,0,0,0,0,0,1,0
"Linear Regression, in Two Ways",") In our case, we love orthogonality because they are key to deriving the equation for the line of best fit through projection. To see what this means, let’s quickly assume a toy example to work with: assume we have three points,  and , as shown below.  As we can see, the three points do not form a single line. Therefore, it’s time for some regression. Let’s assume that this line is defined by . The system of equations which we will attempt to solve looks as follows: Or if you prefer the vector-matrix representation as I do, This system, remind ourselves, does not have a solution because we have geometrically observed that no straight line can pass through all three points. What we can do, however, is find a projection of the vector  onto matrix  so that we can identify a solution that is closest to , which we shall denote as . As you can see, this is where all the linear algebra kicks in. Let’s start by thinking about , the projection of  onto . After some thinking, we can convince ourselves that  is the component of  that lives within the column space of , and that  is the error component of  that lives outside the column space of . From this, it follows that  is orthogonal to , since any non-orthogonal component would have been factored into . Concretely, since the transpose is an alternate representation of the dot product.",0,1,0,0,0,0,0,0
Revisiting Basel with Fourier,"Then, we get With a very small bit of algebra, we end up with And there we have it, the value of ! It’s interesting to see how all this came out of the fourier series of . In this section, we will be taking a look at some interesting representations of the Basel problem, mysteriously packaged in integrals. At a glance, it’s somewhat unintuitive to think that an infinite summation problem can be stated as an integral in exact terms; however, the translation from summation to integrals are not out of the blue. Using things like Taylor series, it is in fact possible to show that the Basel problem can be stated as an integral. For instance, consider this integral One thing I am starting to realize these past few days is that some of these integrals are extremely difficult despite being deceptively simple in their looks. This is a good example. To get started, we might consider making a quick change of variables, namely . This will effectively get rid of the rather messy-looking denominator sitting in the fraction. To make further progress, at this point let’s consider the Taylor series expansion of . We can derive this by considering the following integral: since this integral evaluates to . One way to look at (10) would be to consider it as a sum of some geometric series whose first term begins with 1 and has a constant ratio of . In other words, Here is where a bit of complication comes in.",0,0,0,0,0,0,1,0
Complex Fibonacci,"A simple hack that nonetheless makes a lot of sense in this case is to use the real-number line for two purposes: representing the input dimension, namely the real number line, and one component of the output dimension—the real number portion of the output to Binet’s formula. This admittedly results in a loss of information, since finding the point where  won’t give us the th fibonacci number; instead, it will only tell us what the fibonacci number is whose real number component equals . Nonetheless, this is an approach that makes sense since the real number line is a common dimension in both the input and output data. With this in mind, let’s go ahead and try to plot the interpolation of the fibonacci sequence on the complex plane. First, we import the modules we will need. Then, we simply specify the domain on the real number line and generate the fibonacci numbers, separating out the real and imaginary components. Note that  is not going to be used for plotting; instead, we use  as the -axis, and this is where the loss of temporal information comes in, as mentioned earlier. Now, let’s go ahead and plot it out!  And there it is, the full fibonacci sequence, interpolated across the real numbers. When I first saw this pattern in Matt Parker’s video, I was simply in awe, a loss of words. There’s something inexplicably beautiful and wonderful at this pattern, almost as if it was some part of God’s plan.",0,0,0,0,0,0,1,0
Principal Component Analysis,"Recall from (1) that reconstruction can be achieved by applying compression followed by a decoding operation: Since we know that  is just  and  is  by definition, we can express (1) in a different way. In retrospect, this is somewhat intuitive since  can roughly be thought of as a pseudo-orthonormal matrix—pseudo since there is no guarantee that it is a square matrix. Now, all that is left is to find the matrix . The way to go about this is to reconsider (3), the notion of minimizing data loss, given our findings in (6). In other words, Instead of considering a single observation, here we consider the design matrix in its entirety. Note that  is a design matrix whose rows correspond to a single observation. And because we are dealing with matrices, the Euclidean norm was replaced with its matrix equivalent, the Frobenius norm. Observe that the first term  can safely be removed from the argument since it is a constant with respect to ; let’s also change the argument of the minimum to the maximum given the negative sign. The Frobenius norm of a real matrix can be calculated as Therefore, The last equality is due to a useful property of trace, which is that we can cycle the order of matrices without changing its value. Let’s consider a single column in , denoted as . You might also imagine this as a situation where  is one-dimensional, meaning we want to compress data into a single scalar value.",0,1,0,0,1,0,0,0
Convex Combinations and MAP,"And we have derived the MAP estimate for the mean of the univariate Gaussian! Maximum a posteriori analysis is great and all, but what does the final result exactly tell us? While there might be many ways to interpret understand the result as derived in (9), one particular useful intuition to have relates to the concept of convex combinations. Simply put, a convex combination is a linear combination of different points or quantities in which the coefficients of the linear combinations add up to one. More concretely, We can also imagine that  and  are each -dimensional vectors, and that a convex combination is simply a dot product of these two vectors given that the elements of  sum up to one. Why did I suddenly bring up convex combinations out of no where? Well, it turns out that the result in (9) in fact an instance of a convex combination of two points satisfying the form Indeed, it is not difficult to see that the coefficient of  and  add up to 1, which is precisely the condition for a linear combination to be considered convex. Now here is the important part: the implication of this observation is that we can consider the MAP estimate of parameter  as an interpolation, or more simply, some weighted average between  and . This interpretation also aligns with the whole notion of Bayesian inference: our knowledge of the parameter is partially defined by the prior, but updated as more data is introduced.",0,0,0,0,1,0,0,0
Gaussian Process Regression,"This is where I think GPs get really interesting: the key point of GP is to realize that we want to model some smooth function that best fits our data. What does this “smoothness” mean in terms of covariance? The answer is that  values that are close to each other must be highly correlated, whereas those that are far apart would have low covariance. In other words, knowing the value of  tells us a lot about the value of , whereas it tells us very little about the value of . In short, the closer the values, the higher the covariance. So at the end of the day, all there is to GP regression is to construct this covariance matrix using some distance function. In GPs, these covariance matrices are referred to as kernels. Kernels can be understood as some sort of prior that we impose upon the regression problem. The idea of smoothness noted earlier is one such example of a prior. But it is a general prior that makes a lot of sense, since we normally don’t want stepwise or non-differential functions as the result of regression. But there are hundreds and thousands of kernels out there that each suit different purposes. For the sake of simplicity, however, we will only take a look at one such kernel that relates to smoothness: the squared exponential kernel, often referred to as the RBF kernel.",1,0,0,0,0,1,0,0
