title,body,from_scratch,linear_algebra,deep_learning,tensorflow,statistics,machine_learning,analysis,probability_distribution
PyTorch Tensor Basics,"Observe that the addition is not reflected in , indicating that no operations happened in-place. , however, achieves the result without copying and creating a new tensor into memory. is another common function that is used to resize tensors. It has been part of the PyTorch API for quite a long time before  was introduced. Without getting into too much technical detail, we can roughly understand view as being similar to  in that it is not an in-place operation. However, there are some notable differences. For example, this Stack Overflow post introduces an interesting example: On the other hand,  does not run into this error. The difference between the two functions is that, whereas  can only be used on contiguous tensors. This SO thread gives a nice explanation of what it means for tensors to be contiguous; the bottom line is that, some operations, such , do not create a completely new tensor, but returns a tensor that shares the data with the original tensor while having different index locations for each element. These tensors do not exist contiguously in memory. This is why calling  after a transpose operation raises an error. , on the other hand, does not have this contiguity requirement. This felt somewhat overly technical, and I doubt I will personally ever use  over , but I thought it is an interesting detail to take note of nonetheless. Another point of confusion for me was the fact that there appeared to be two different ways of initializing tensors:  and .",0,0,1,0,0,0,0,0
PyTorch Tensor Basics,"Not only do the two functions look similar, they also practically do the same thing. Upon more observation, however, I realized that there were some differences, the most notable of which was the .  seemed to be unable to infer the data type from the input given. On the other hand,  was sable to infer the data type from the given input, which was a list of integers. Sure enough,  is generally non-configurable, especially when it comes to data types. can accept  as a valid argument. The conclusion of this analysis is clear: use  instead of . Indeed, this SO post also confirms the fact that  should generally be used, as  is more of a super class from which other classes inherit. As it is an abstract super class, using it directly does not seem to make much sense. In PyTorch, there are two ways of checking the dimension of a tensor:  and . Note that the former is a function call, whereas the later is a property. Despite this difference, they essentially achieve the same functionality. To access one of the  elements, we need appropriate indexing. In the case of , it suffices to consider the size as a list, meaning that square bracket syntax can be used. In the case of , indices can directly be passed into as an argument to index individual elements in the size tensor. These past few days, I’ve spent a fair amount of time using PyTorch for basic modeling.",0,0,1,0,0,0,0,0
On Expectations and Integrals,"Expectation is a core concept in statistics, and it is no surprise that any student interested in probability and statistics may have seen some expression like this: In the continuous case, the expression is most commonly presented in textbooks as follows: However, this variant might throw you off, which happened to me when I first came across it a few weeks ago: I mean, my calculus is rusty, but it kind of makes sense: the probably density function is, after all, a derivative of the cumulative density function, and so notationally there is some degree of coherency here. But still, this definition of the expected value threw me off quite a bit. What does it mean to integrate over a distribution function instead of a variable? After some research, however, the math gurus at Stack Exchange provided me with an answer. So here is a brief summary of my findings. The integral that we all know of is called the Riemann integral. The confusing integral is in fact a generalization of the Riemann integral, known as the Riemann-Stieltjes integral (don’t ask me how to pronounce the name of the Dutch mathematician). There is an even more general interpretation of integrals called the Lebesgue integral, but we won’t get into that here. First, let’s take a look at the definition. The definition of the integral is actually a lot simpler than what one might imagine. Here,  is a value that falls within the interval . In short, we divide the interval of integration  into  infinitesimal pieces.",0,0,0,0,1,0,0,0
Convolutional Neural Network with Keras,"This visualization will help us see whether our model is actually learning with each epoch, and whether or not overfitting is occurring at any point in training. The last piece of the puzzle we need is the  function. This function is essentially wraps all the functions we have created previously, first by loading the data, training using that data, building a model, training a model, and calling on the  function to provide a visualization of the model’s learning curve. One minor tweak I used to spice up this function is the , which basically creates more images for the neural network to train on by slightly modifying existing images in the training set. These modifications involve shifting, zooming, and flipping. When we don’t have enough data to train our model on, using the  can be useful. Finally, let’s see how well our model performs!  The result shows that the model has learned decently well, with testing accuracy of approximately 80 percent. This is not the best result, but it is certainly not bad, especially given the fact that the images in the dataset, as we have seen above, are very pixelated and sometimes difficult for even humans to decipher and categorize. That’s all for today. It’s fascinating to see how CNNs are capable of perceiving images and categorizing them after appropriate training. But as we all know, the potential of neural networks far extends beyond image classificaiton.",0,0,1,1,0,0,0,0
A PyTorch Primer,"Another difference we see is , which, as the variable name makes apparent, is the optimizer that we use for backpropagation. In this specific instance, we use SGD. Each backpropagation step is then performed simply via . In this tutorial, we took a very brief look at the PyTorch model. This is by no means a comprehensive guide, and I could not even tell anyone that I “know” how to use PyTorch. Nonetheless, I’m glad that I was able to gain some exposure to the famed PyTorch module. Also, working with Django has somewhat helped me grasp the idea of classes more easily, which certainly helped me take in class-based concepts in PyTorch more easily. I distinctively remember people saying that PyTorch is more object-oriented compared to TensorFlow, and I might express agreement to that statement after having gone through the extreme basics of PyTorch. In the upcoming articles, I hope to use PyTorch to build more realistic models, preferrably in the domain of NLP, as that seems to be where PyTorch’s comparative advantage stands out the most compared to TensorFlow. Of course, this is not to say that I don’t like TensorFlow anymore, or that PyTorch is not an appropriate module to use in non-NLP contexts: I think each of them are powerful libraries of their own that provide a unique set of functionalities for the user. And being bilinguial—or even a polyglot, if you can use things like Caffe perhaps—in the DL module landscape will certainly not hurt at all.",0,0,1,0,0,0,0,0
My First GAN,"As this competition progresses, the generator becomes increasingly better at creating fake images; the discriminator also starts to excel at determining the veracity of a presented image. Enough of theoretical dwellings, let’s begin by defining the generator model. The  is a function that returns a generator model according to some set parameters. Let’s take a look at the structure of this network in more detail.  Notice that the output of the generator is a batch image of dimensions . This is exactly the same as the , , and  information we defined earlier, and that is no coincidence: in order to fool the discriminator, the generator has to generate images that are of the same dimensions as the training images from ImageNet. Now it’s time to complete the GAN by creating a corresponding discriminator, the discerning police officer. The discriminator is essentially a simple binary classier that ascertains whether a given image is true or fake. Therefore, it is no surprise that the final output layer will have one neuron with a sigmoid activation function. Let’s take a more detailed look at the  function as shown below. And again, a model summary for convenient reference:  Now we have both the discriminator and the generator, but the two are not really connected in the sense that they exist as discrete models lacking any connection between them. What we want to do, however, is to establish some relationship between the generator and the discriminator to complete a GAN, and hence train them in conjunction.",0,0,1,1,0,0,0,0
Principal Component Analysis,"PCA is a very useful technique used in many areas of machine learning. One of the most common applications is to apply PCA to a high-dimensional dataset before applying a clustering algorithm. This makes it easier for the ML model to cluster data, since the data is now aligned in such a way that it shows the most variance. Upon some more research, I also found an interesting paper that shows that there is a solid mathematical relationship between K-means clustering and PCA. I haven’t read the paper from top to bottom, but instead glossed over a summary of the paper on this thread on stack overflow. It’s certainly a lot of information to take in, and I have no intent of covering this topic in this already rather lengthy post on PCA. So perhaps this discussion will be tabled for a later time, as interesting as it seems. I hope you enjoyed reading this post. Amidst the chaos of the COVID19 pandemic, let’s try to stay strong and find peace ruminating over some matrices and formulas. Trust me, it works better than you might think.",0,1,0,0,1,0,0,0
A sneak peek at Bayesian Inference,"Notice that this line of code directly corresponds to the formula for the updated Beta posterior distribution we found earlier, which is  refers to ,  corresponds to , and both  and  are set to  in order to take into account the initial prior which tends to a uniform distribution. An interesting observation we can make about this result is that the variance of the Beta posterior decreases with more trials, i.e. the narrower the distribution gets. This is directly reflective of the fact that we grow increasingly confident about our estimate of the parameter with more tosses of the coin. At the end of the 500th trial, we can conclude that the coin is fair indeed, which is expected given that we simulated the coin flip using the command . If we were to alter the argument for this method, say , then we would expect the final result of the update to reflect the coin’s bias. Bayes’ theorem is a powerful tool that is the basis of Bayesian statistical analysis. Although our example was just a simple coin toss, the sample principle and mechanism can be extended to countless other situations, which is why Baye’s theorem remains highly relevant to this day, especially in the field of machine learning and statistical analysis. Bayesian statistics presents us with an interesting way of understanding probability. The classical way of understanding probability is the frequentist approach, which purports that a probability for an event is the limit of its frequency in infinite trials.",0,0,0,0,1,0,0,1
Fisher Score and Information,"Although the derivation is by no means mathematically robust, it nonetheless vindicates a notion that is not necessary apparently obvious, yet makes a lot of intuitive sense in hindsight. I personally found this video by Ben Lambert to be particularly helpful in understanding the connection between likelihood and information. The gist of it is simple: if we consider the Hessian or the second derivative to be indicative of the curvature of the likelihood function, the variance of our estimate of the optimal parameter  would be larger if the curvature was smaller, and vice versa. In a sense, the larger the value of the information matrix, the more certain we are about the estimate, and thus the more information we know about the parameter. I hope you enjoyed reading this post. Catch you up on another post, most likely on the Leibniz rule, then natural gradient descent!.",0,0,0,0,1,0,0,0
Logistic Regression Model from Scratch,"The main takeaway here is the the gradient descent method allows us to find the local minimum of any convex function, no matter how multidimensional or complex. This is an incredibly powerful statement, and it is one that lies at the core of many machine learning algorithms. To implement gradient descent with code, we have to figure out what the gradient descent equation is in the case of logistic regression. To do this, we need a bit of calculus work using the chain rule. Recall that our goal is to compute since we want to calculate the slope of the cross entropy function with respect to the weights vector. For notational convenience, let’s denote the gradient as a derivative: The gradient in (7) can be broken down into distinct components via the chain rule: where So the task of calculating the gradient now boils down to finding the derivative for each of the terms shown in (8). Let’s start with the easiet one, the last term, which is the derivative of  with respect to . From (9), we can conclude that The next in line is the derivative of the sigmoid function, which goes as follows: Now we are almost there. The last piece of the puzzle is computing the first term in (8), the derivative of the cross entropy function. Putting this all together into (8), we get: Voila! We have derived an expression for the gradient of the cross entropy loss function.",1,0,0,0,0,1,0,0
Traveling Salesman Problem with Genetic Algorithms,"I therefore decided to create a much more contrived example, but with many coordinates, so that we can easily verify whether the path decided on by the algorithm is indeed the optimal path. Namely, we will be arranging city coordinates to lie on a semi-circle, using the very familiar equation Let’s create 100 such fake cities and run the genetic algorithm to optimize the path. If the algorithm does successfully find an optimal path, it will be a single curve from one end of the semi-circle fully connected all the way up to its other end.  The algorithm seems to have converged, but the returned  does not seem to be the optimal path, as it is not a sorted array from 0 to 99 as we expect. Plotting this result, the fact that the algorithm hasn’t quite found the most optimal solution becomes clearer. This point notwithstanding, it is still worth noting that the algorithm has found what might be referred to as optimal segments: notice that there are some segments of the path that contain consecutive numbers, which is what we would expect to see in the optimal path.  An optimal path would look as follows.  Comparing the two, we see that the optimal path returned by the genetic algorithm does contain some wasted traveling routes, namely the the chords between certain non-adjacent cities. Nonetheless, a lot of the adjacent cities are connected (hence the use of the aforementioned term, optimal segments).",1,0,0,0,0,0,0,0
A sneak peek at Bayesian Inference,"Let’s start by coming up with a model representation of the likelihood function, which we might recall is the probability of having a parameter value of  given some data . It is not difficult to see that the best distribution for the likelihood function given the setup of the problem is the binary distribution since each coin flip is a Bernoulli trial. Let  denote a random variable that represents the number of tails in  coin flips. For convenience purposes, we define 1 to be heads and 0 to be tails. Then, the conditional probability of obtaining  heads given a fairness parameter  can be expressed as We can perform a quick sanity check on this formula by observing that, when , the probability of observing  heads diminishes to 0, unless , in which case the probability becomes 1. This behavior is expected since  represents a perfectly biased coin that always shows tails. By symmetry, the same logic applies to a hypothetical coin that always shows heads, and represents a fairness parameter of 1. Now that we have derived a likelihood function, we move onto the next component necessary for Bayesian analysis: the prior. Determining a probability distribution for the prior is a bit more challenging than coming up with the likelihood function, but we do have certain clues as to what characteristics our prior should look possess. First, the domain of the prior probability distribution should be contained within . This is because the range of the fairness parameter  is also defined within this range.",0,0,0,0,1,0,0,1
Gamma and Zeta,"The article also notes, however, that this definition only applies in a limited number of cases. This is because we’ve assumed, in using the summation of the geometric series formula, the fact that . Today’s post was a short yet very interesting piece on the relationship between the Gamma and the Riemann zeta. One thing I think could have been executed better is the depth of the article—for instance, what is the Bose integral and when is it used? I’ve read a few comments on the original YouTube video by blackpenredpen, where people were saying that the Bose integral is used in statistical mechanics and the study of black matter, but discussing that would require so much domain knowledge to cover. Regardless, I think the theoretical aspect of this derivation is interesting nonetheless. One thing I must do is writing a post on divergence and when the interchange of summation and integrals can be performed. I was originally planning to write a much longer article dividing deep into the Gamma and the Beta function as well as their distributions. However, I realized that what I need at this point in time is producing output and reorienting myself back to self-studying blogger mode, perhaps taking a brief hiatus from the grinding intern spending endless hours in Sublime text with Django (of course, I’m doing that because I enjoy and love the dev work).",0,0,0,0,0,0,1,0
How lucky was I on my shift?,"Simply put, a binomial distribution simulates multiple Bernoulli trials, which are experiments with only two discrete results, such as heads and tails, or more generally, successes and failures. A binomial random variable  can be defined as the number of success in  repeated trials with probability of success . For example, if we perform ten tosses of a fair coin, the random variable would be the number of heads;  would be , and  would be . Mathematically, the probability distribution function of a binomial distribution can be written as follows: We can derive this equation by running a simple thought experiment. Let’s say we are tossing a coin ten times. How can we obtain the probability of getting one head and nine tails? To begin with, here is the list of all possible arrangements: Notice that all we had to do was to choose one number  that specifies the index of the trial in which a coin toss produced a head. Because there are ten ways of choosing a number from integers  to , we got ten different arrangements of the situation satisfying the condition . You might recall that this combinatoric condition can be expressed as , which is the coefficient of the binomial distribution equation. Now that we know that there are ten different cases, we have to evaluate the probability that each of these cases occur, since the total probability , where . Calculating this probability is simple: take the first case,  as an example.",0,0,0,0,1,0,0,1
A PyTorch Primer,"To build our simple model, let’s first write out some variables to use, starting with the configuration of our model and its dimensions. We will also need some input and output tensors to be fed into the model for trainining and optimization. Next, here are the weight matrices we will use. For now, we assume a simple two layered dense feed forward network. Last but not least, let’s define a simple squared error loss function to use during the training step. With this entire setup, we can now hash out what the entire training iteration is going to look like. Wrapped in a loop, we perform one forward pass, then perform backpropagation to adjust the weights. Great! We see that the loss drops as more epochs elapse. While there is no problem with this approach, things can get a lot more unwieldy once we start building out more complicated models. In these cases, we will want to use the auto differentiation functionality we reviewed earlier. Let’s see this in action. Also, let’s make this more PyTorch-y by making use of classes. We will revisit why class-based implementations are important in the next section. Notice we didn’t have to explicitly specify the backpropagation formula with matrix derivatives: by simply calling  properties for each of the weights matrices, we were able to perform gradient descent.",0,0,1,0,0,0,0,0
"Linear Regression, in Two Ways","We can further specify this equation by using the fact that  can be expressed as a linear combination of the columns of . In other words, where  is the solution to the system of equations represented by . Let’s further unpackage (1) using matrix multiplication. Therefore, We finally have a formula for : Let’s remind ourselves of what  is and where we were trying to get at with projection in the context of regression. We started off by plotting three data points, which we observed did not form a straight line. Therefore, we set out to identify the line of best fit by expressing the system of equations in matrix form, , where . But because this system does not have a solution, we ended up modifying the problem to , since this is as close as we can get to solving an otherwise unsolvable system. So that’s where we are with equation (2): a formula for , which contains the parameters that define our line of best fit. Linear regression is now complete. It’s time to put our equation to the test by applying it to our toy data set. Let’s apply (2) in the context of our toy example with three data points to perform a quick sanity check. Calculating the inverse of  is going to be a slight challenge, but this process is going to be a simple plug-and-play for the most part.",0,1,0,0,0,0,0,0
"0.5!: Gamma Function, Distribution, and More","We derive both sides by  to obtain the following: Notice the harmonic series embedded in the expression above. To further simplify this expression, we derive an interpolation of the harmonic series. Let the interpolation be denoted as : We derive both sides by  to obtain the following: The expression above is the sum of a geometric series with radius . We integrate both sides by  to obtain . We are almost done! Now that we have the expression for the harmonic series, we can plug it back into the original equation on  to finish off this derivation. Integrate both sides by  to obtain the following: Exponentiate both sides by  to remove the logarithm, and we finally get the alternative representation of the Gamma function: So we see that there are many other alternate modes of expressing the same function, . But the truth that remains unchanged is that the Gamma function is essentially a more expansive definition of the factorial that allows for operations on any real numbers. There are many concepts and theories surrounding the Gamma function, such as the Euler-Mascheroni constant, Mellin transformation, and countless many more, but these might be tabled for another discussion as they each deserve a separate post. The Gamma distribution is, just like the binomial and Poisson distribution we saw earlier, ways of modeling the distribution of some random variable . Deriving the probability density function of the Gamma distribution is fairly simple. We start with two parameters,  and , using which we can construct a Gamma function.",0,0,0,0,1,0,0,1
