title,body,from_scratch,linear_algebra,deep_learning,tensorflow,statistics,machine_learning,analysis,probability_distribution
Demystifying Entropy (And More),"Then, cross entropy would have been calculated as Indeed, we can use our function to verify the coherency of this statement. In other words, when our predicted distribution equals the true distribution we are trying to model, cross entropy becomes 0, as a desirable cost function would behave. This is why crosss entropy is often used in classification models where we have a one-hot encoded vector that represents a true distribution, as exemplified by , and a prediction that models this distribution, denoted as  in our example. It is not difficult to see why cross entropy is a useful cost function frequently used in the field of machine learning. Entropy is an interesting concept with which we can quantify randomness in data. This process is no rocket science, but simply a process that involves calculations with probabilities. Although the link may not be immediately apparent, randomness is just another way of expressing probabilities and uncertainty, and it is from this premise that information and entropy take off. Beyond that, however, entropy is now used extensively in the field of machine learning, specifically as a loss function. Although it was not noted explicitly above, cross entropy calculates the same quantity as the logarithmic loss function. Essentially, cross entropy is useful in that it provides us with some intuitive information of how far two distributions are apart.",0,0,0,0,1,0,0,0
Demystifying Entropy (And More),"However, we can get a bit more scientific by calculating the cross entropy to see exactly how well our model performed with the given data. To achieve this, let’s quickly write some functions to calculate KL divergence and cross entropy. We will be reusing the  function we defined above. On a trivial note, we prevent Python from running into math domain errors, we add  to the provided distribution if the list contains 0. The result is unsurprising. If we recall that the definition of entropy is the amount of information content needed to encode information, we will quickly realize that  is a distribution with probability 1, which is why it makes sense that entropy converges to 0. Therefore, in this case, KL divergence equals cross entropy, which computes to approximately 0.415. What actually happened beneath the hood? If we recall the definition of cross entropy, we can easily see that, among the 10 terms, 9 of them were eliminated since  given the setup of the distribution . In the end, the only term that mattered was the third term, which was given by Why does this quantity make sense as an error term defining a loss function? In other words, why is cross entropy used as a loss function in classification tasks? To see this, let’s assume that our neural network was perfect in its prediction, or more realistically, trained to excessively overfit given data, i.e,  equals .",0,0,0,0,1,0,0,0
PyTorch Tensor Basics,"One of the main takeaways from that experience is that an intuition on dimensionality and tensor operations in general is a huge plus. This gets especially important for things like batching. One very basic thing I learned–admittedly perhaps too belatedly–is the difference between  and  as dimensions. Here is a concrete example. This creates a one-dimensional tensor, which is effectively a list. We can check the dimensions of this tensor by calling , which is very similar to how NumPy works. On the other hand, specifying the size as  results in a two-dimensional tensor. The simple, barely passing answer to the question of why  is two-dimension would be that it has double layered brackets. More exactly speaking, having an additional layer means that it is capable of storing another tensor within it; hence,  is living in a dimension that is one above that of . As mentioned earlier, batch dimension is something that becomes very important later on. Some PyTorch layers, most notably RNNs, even have an argument , which accepts a boolean value. If , PyTorch expects the first dimension of the input to be the batch dimension. If , which is the case by default, PyTorch assumes that the first dimension would be the sequence length dimension. A common operation that is used when dealing with inputs is , or its inverse, . Before explaining what these operations perform, let’s just take a look at an example. Let’s start with , the random tensor of size  initialized above.",0,0,1,0,0,0,0,0
Markov Chain and Chutes and Ladders,"This block produces the following figure: I doubt that anyone would play Chutes and Ladders for this long, but after about 150 rolls of the dice, we can expect with a fair amount of certainty that the game will come to an end. The graph above presents information on cumulative fractions, but we can also look at the graph for marginal probabilities by examining its derivative: And the result: From the looks of it, the maximum of the graph seems to exist somewhere around . To be exact, . This result tells us that we will finish the game in 19 rolls of the dice more often than any other number of turns. We can also use this information to calculate the expected value of the game length. Recall that Or if the probability density function is continuous, In this case, we have a discrete random variable, so we adopt the first formula for our analysis. The formula can be achieved in Python as follows: This result tells us that the typical length of a Chutes and Ladders game is approximately 36 turns. But an issue with using expected value as a metric of analysis is that long games with infinitesimal probabilities are weighted equally to short games of substantial probability of occurrence. This mistreatment can be corrected for by other ways of understanding the distribution, such as median: This function tries to find the point in the cumulative distribution where the value is closest to , i.e. the median of the distribution.",0,1,0,0,0,0,0,0
The Math Behind GANs,"Therefore, we might consider the following to be the loss function of the discriminator: Here, we are using a very generic, unspecific notation for  to refer to some function that tells us the distance or the difference between the two functional parameters. (If this reminded you of something like cross entropy or Kullback-Leibler divergence, you are definitely on the right track.) We can go ahead and do the same for the generator. The goal of the generator is to confuse the discriminator as much as possible such that it mislabels generated images as being true. The key here is to remember that a loss function is something that we wish to minimize. In the case of the generator, it should strive to minimize the difference between 1, the label for true data, and the discriminator’s evaluation of the generated fake data. A common loss function that is used in binary classification problems is binary cross entropy. As a quick review, let’s remind ourselves of what the formula for cross entropy looks like: In classification tasks, the random variable is discrete. Hence, the expectation can be expressed as a summation. We can simplify this expression even further in the case of binary cross entropy, since there are only two labels: zero and one. This is the  function that we have been loosely using in the sections above.",0,0,1,0,1,0,0,0
"Beta, Bayes, and Multi-armed Bandits","Let’s take a look at the posterior distribution for each bandit. We can easily plot them using , as shown below. Notice that I have also included the uniform prior for reference purposes.  The result is as we would expect: the bandit with the highest success parameter of 0.7 seems to have been pulled on the most, which explains why its variance is the smallest out of the bunch. Moreover, the mean of that particular posterior is also close to 0.7, its true value. Notice that the rest of the posteriors also somewhat have this trend, although more uncertainty is reflected into the shape of the distributions via the spread. It is interesting to see how we can go from a uniform prior, or , to almost normal-shaped distributions as we see above. To corroborate our intuition that the best bandit was indeed the most pulled, let’s quickly see the proportion of the pulls through a pie chart.  As you can see, there seems to be a positive correlation between the success parameter and the number of pulls. This is certainly good, since we want the gambler to pull on the best bandit the majority of times while avoiding the worse ones as much as possible. This certainly seems to be the case, given that the bandit with the worse parameter—0.1—was pulled the least. Last but not least, let’s revisit the cumulative regret graph introduced earlier.",0,0,0,0,1,0,0,1
A Simple Autocomplete Model,"You might remember back in the old days when autocomplete was just terrible. The suggestions provided by autocomplete would be useless if not downright stupid—I remember that one day when I intended to type “Gimme a sec,” only to see my message get edited into “Gimme a sex” by the divine touches of autocomplete. On the same day, the feature was turned off on my phone for the betterment of the world. Now, times have changed. Recently, I decided to give autocorrect a chance on my iPhone. Surprisingly, I find myself liking autocomplete more than hating it, especially now that the weather is getting colder by each day: when my frost-numbed finger tips touch on the wrong places of the phone screen to produce words that aren’t really words, iPhone’s autocomplete somehow magically reads my mind to rearrange all that inscrutable alphabet soup into words that make actual, coherent sense. Sometimes, it’s so good at correcting my typos that I intentionnally make careless mistakes on the keyboard just to see how far it can go. One of the obvious reasons behind such drastic improvements in autocomplete functionality is the development of deep neural networks. As we know, neural networks are great at learning hidden patterns as long as we feed it with enough data. In this post, we will implement a very simple version of a generative deep neural network that can easily form the backbone of some character-based autocomplete algorithm. Let’s begin! Let’s first go ahead and import all dependencies for this tutorial.",0,0,1,1,0,0,0,0
A Step Up with  Variational Autoencoders,"It’s finally time to test the model. Let’s first begin with data preparation and preprocessing. Now, we should have the training and test set ready to be fed into our network. Next, let’s define a simple callback application using the  monitor so that training can be stopped when no substantial improvements are being made to our model. This was included because training a VAE can take some time, and we don’t want to waste computing resources seeing only submarginal increments to the model performance. Training begins! After 14 epochs, training has stopped, meaning that no meaningful improvements were being made. Let’s visualize the representation of the latent space learned by the VAE. Visualizing this representation is easy in this case because we defined the latent space to be two-dimensional; in other words, all points can be plotted on a Cartesian plane. Let’s take a look:  This plot shows us how each numbers are distributed across the latent space. Notice that numbers that belong to the same class seem to be generally clustered around each other, although there is a messy region in the middle. This is a reasonable result: while we would expect ones to be fairly easy to distinguish from, say, eights, numbers like zeros and sixes might look very similar, and hence appear mixed as a lump in the fuzzy region in the middle. One cool thing about VAEs is that we can use their learned representation to see how numbers slowly morph and vary across a specified domain.",0,0,1,1,0,0,0,0
A Brief Introduction to Recurrent Neural Networks,"Then, the output of this embedding layer will be flattened to be passed onto a dense layer with one output transformed by the sigmoid activation function. We use the sigmoid function since we want to conduct a sentiment analysis of determining whether a given movie review is positive or negative. That wasn’t so difficult. Let’s initialize our model by defining the model parameters , , and , then plot the model to see the structure of the network alongside the input and output dimensions of each layer. Note that we defined  to be 16, which means that each word is transformed into dense vectors living in 16 dimensions. By plotting the model, we can get a better idea of the layers that compose the model.  The next model we will build is a simple recurrent neural network. This neural network is going to have an embedding layer, just like the previous model. However, instead of a dense layer, it will have two consecutive  layers stacked on top of each other. The  layer is essentially the  implementation of the  model we built earlier. Let’s take a look. We instantiate the model and take plot the network, just as we have done above.  The  model we built is, as the name shamelessly puts out, pretty simple. There are a lot more advanced recurrent neural networks that have complicated internal cell structures to better emulate human memory, in a sense.",0,0,1,1,0,0,0,0
A Brief Introduction to Recurrent Neural Networks,"Last but not least, let’s visualize the training scheme of all four models to take a identify any possible signs of convergence and overfitting, if any. To do that, we will be using the  function shown below. The dense feed-forward network seems to have a very linear pattern. One immediate pattern we see is that the model seems to be overfitting right away, since the testing accuracy decreases with each epoch while the training accuracy increases. This is certainly not a good sign; in the best case scenario, we want to see that training and testing labels moving in the same direction. Perhaps this is the biggest indication that a simple feed forward network is a suboptimal model choice in the context of this problem.  The graphs for the  model seems a lot better. At the very least, we see the training and test labels moving in unison: the accuracy increases with each epoch, while the loss slowly decreases. However, we do see some overfitting happening at the last two epochs or so. Specifically, note that cross entropy loss for the testing data seems to pick up an incrementing pattern past the seventh epoch. This observation suggests that we need to configure the model differently, presumably by decreasing the number of tunable parameters.  Next comes the winner of the day, the LSTM network. An interesting point to note about the learning curve of this model is that the test data accuracy and loss seem to stay roughly stagnant despite the progression of epochs.",0,0,1,1,0,0,0,0
Dissecting LSTMs,"The raw material that we pass into this filter is in fact the cell state, processed by a  activation function. This is also a familiar structure we saw earlier in the information update sequence of the network. Only this time, we use the cell state to generate output. This makes sense somewhat intuitively, since the cell state is essentially the memory of the network, and hence to generate output would require the use of this memory. Of course, this should not be construed so literally since what ultimately happens during backpropagation is entirely up to the network, and at that point we simply lay back and hope for the network to learn the best. This point notwithstanding, I find this admittedly coarse heuristic to be nonetheless useful in intuiting the clockwork behind LSTMs. At this point, we’re not quite done yet;  is not a vector of probabilities indicating which letter is the most likely in a one-hot encoded representation. Therefore, we will need to pass it through another affine layer, than apply a softmax activation. Hence,  is the final output of an LSTM layer. Here comes the tricky part: backprop. Thankfully, backprop is somewhat simple in the case of LSTMs due to the use of Hadamard products. The routine is not so much different from a vanilla neural network, so let’s try to hash out the equations. As we already know, backpropagation in neural networks is merely an extended application of the chain rule, with some minor caveats that matrix calculus entails.",0,0,1,0,0,0,0,0
An Introduction to Markov Chain Monte Carlo,"In the Metrapolis-Hastings model, the proposal distribution is assumed as normal. Next, we have to decide if the current value of  is a value to accept or not. Accepting a randomly sampled value means adding it to our list of historic observations—if we draw a histogram of the entries in this list, it is our hope that we would end up with a close approximation of the posterior distribution. Accepting this value is often referred to as a “jump,” because we can visualize this process as a random walk in the posterior sample space from point  to . The question is, how do we decide to jump or not? The answer lies in Bayes’ theorem: If, for example, we should accept the value and perform the jump, because this means that the new proposed parameter does a better job of explaining the data than does the current one. But recall the dilemma we discussed earlier: how do we compute the posterior? After all, the complexity of calcualting evidence was the very reason why scientists came up with MCMC in the first place. Well, here’s a clever trick that might be of use: rearrange (5) in fractional form to get rid of the evidence term in the denominator. In other words, (5) can be reexpressed as which means The evidence term nicely disappears, giving us an expression that we can easily evaluate! This is how Metropolis-Hastings resolves the dilemma of evidence computation—very simple yet some surprisingly effective algebra.",1,0,0,0,0,0,0,0
Logistic Regression Model from Scratch,"This tutorial is a continuation of the “from scratch” series we started last time with the blog post demonstrating the implementation of a simple k-nearest neighbors algorithm. The machine learning model we will be looking at today is logistic regression. If the “regression” part sounds familiar, yes, that is because logistic regression is a close cousin of linear regression—both models are employed in the context of regression problems. Linear regression is used when the estimation parameter is a continuous variable; logistic regression is best suited to tackle binary classification problems. Implementing the logistic regression model is slightly more challenging due to the mathematics involved in gradient descent, but we will make every step explicit throughout the way. Without further ado, let’s get into it. To understand the clockwork behind logistic regression, it is necessary to understand the logistic function. Simply put, the logistic function is a s-shaped curve the squishes real values between positive and negative infinity into the range . This property is convenient from a machine learning perspective because it allows us to perform binary classification. Binary classification is a type of classification problem where we are assigned the task of categorizing data into two groups. For instance, given the dimensions of a patient’s tumor, determine whether the tumor is malignant or benign. Another problem might involve classifying emails as either spam or not spam. We can label spam emails as 1 and non-spam emails as 0, feed the data into a predefined machine learning algorithm, and generate predictions using that model.",1,0,0,0,0,1,0,0
Logistic Regression Model from Scratch,"Now what’s next? Since we have a loss function, we need to build an algorithm that will allow us to minimize this cost function. One of the most common methods used to achieve cost minimization is gradient descent. As you might be able to tell, this algorithm has a lot to do with gradients, which can loosely be understood as a fancy way of saying derivatives. Below is an illustration of the gradient descent algorithm in action, sourced from this blog.  Basically, what gradient descent does is that it takes the derivative of the loss function with respect to the weight vector every epoch, or iteration, and takes a small step in the opposite direction of that derivative. If you think of this in the context of two dimensions as shown in the illustration, the gradient descent algorithm ends up moving down the parabola, taking little steps each time, until it eventually reaches the global minimum. In mathematical notation, we might express this process as follows: If we were to perform this in vectorized format, where  represents a vector containing the weight coefficients of the logistic regression model: The  notation is used to denote gradients, an important operation in matrix calculus which we explored in when deriving the normal equation solution to linear regression on this blog. The  denotes a hyperparameter known as the learning rate, which essentially determines how big of a step the gradient descent model takes with each iteration.",1,0,0,0,0,1,0,0
"Beta, Bayes, and Multi-armed Bandits","However, this is obviously not the most systematic approach, and there is not even a clear guideline as to how they should go about pulling these levers. Here is where the Bayesian approach comes in handy. It isn’t difficult to frame this as a Bayesian problem. Given a pull of the slot machine, the result of which we will denote as , a Bernoulli random variable, we can then formulate the problem as follows: And as the classical Bayesian analysis goes, the more data we collect through repeated experiments, the closer the posterior distribution will get to the target distribution. Through this process, we are able to approximate the parameter . Now we have to think about what distributions we want to use for the prior and likelihood. Let’s start with the easier one: the likelihood. The natural choice that makes sense is the binomial distribution. Each pull on the lever can be considered a Bernoulli trial, and as we start exploring with more pulls to accumulate data, we will essentially be sampling from a binomial distribution, with  success and  failures out of a total of  trials. Therefore, more concretely, we can say The more interesting part is the prior distribution. Intuitively, the one might be inclined to say that we need a uniform prior, and indeed that answer would technically be true. However, I qualify with “technically” since the real answer has an added layer of complexity.",0,0,0,0,1,0,0,1
Demystifying Entropy (And More),"This yields Recall that the definition of entropy goes as Plugging in this definition to (11) yields the simplified definition of cross entropy: If KL divergence represents the average amount of additional information needed to represent an event with  instead of , cross entropy tells us the average amount of total information needed to represent a stochastic event with  instead of . This is why cross entropy is a sum of the entropy of the distribution  plus the KL divergence between  and . Instead of dwelling in the theoretical realm regurgitating different definitions and interpretations of cross entropy and KL divergence, let’s take a look at a realistic example to gain a better grasp of these concepts. Say we have constructed a neural network to solve a task, such as MNIST hand-written digit classification. Let’s say we have fed our neural network an image corresponding to the number 2. In that case, the true distribution that we are trying to model, represented in vector form, will be  as shown below. The  statement is there to make sure that the probabilities sum up to 1. Let’s assume that our neural network made the following prediction about image. These two distributions, although similar, are different. But the question is, how different? Creating a visualization might give us some idea about the difference between the two distributions.  The two distributions are quite similar, meaning that our neural network did a good job of classifying given data.",0,0,0,0,1,0,0,0
Recommendation Algorithm with SVD,"Much like we understood  as a factor of eigendecomposition,  can be seen as a factor of eigendecomposition, this time on the matrix . Concretly, Notice the parallel between (2) and (4). It’s not difficult to see that, by symmetry,  is also going to be an orthogonal matrix containing the eigenvectors of . The most important difference between  and  concerns dimensionality: while  is a -by- matrix, V is an -by-. This disparity originates from the fact that  itself is a rectangular matrix, meaning that the dimensions of  and  are also different. Another point that requires clarification pertains to . Earlier, we made a substitution of  for . This tells us that  contains the square roots of the eigenvalues of  and , which, it is important to note, has identical non-zero eigenvalues. If this point brings confusion, I recommend that you peruse over the next subsection on linear algebra. Let’s conclude this section with the formula for singular value decomposition: Hopefully, now it is clear what , , and  are. Singular value decomposition can intuitively be thought of as a square root version of eigendecomposition, since essentially  and  are all derivatives that come from the “square” of a matrix, the two transpose multiples. This intuition also aligns with the fact that  is a diagonal matrix containing the square roots of eigenvalues of the transpose products. With these in mind, let’s get ready to build the recommendation model.",1,1,0,0,0,0,0,0
