title,body,from_scratch,linear_algebra,deep_learning,tensorflow,statistics,machine_learning,analysis,probability_distribution
How lucky was I on my shift?,"Nonetheless, we can approximate the distribution of this random variable by considering each ten-minute blocks as a unit for a single trial, i.e. if a call is received by the PMO between 22:00 and 22:10, then the trial is a success; if not, a failure. Blocking eight hours by ten minutes gives us a total of 48 trials. Because we assumed the average number of phone calls on a single shift to be 12, the probability of success . Let’s simulate this experiment  times. We can model this binomial distribution as follows: This code block produces the following output: Under this assumption, we can also calculate how lucky I was yesterday when I only received five calls by plugging in the appropriate values into the binomial PMF function: From a frequentist’s point of view, I would have lazy days like these only 7 times for every thousand days, which is nearly three years! Given that my military service will last only 1.5 years from now, I won’t every have such a lucky day again, at least according to the binomial distribution. But a few glaring problem exists with this mode of analysis. For one, we operated under a rather shaky definition of a trial by arbitrarily segmenting eight hours into ten-minute blocks. If we modify this definition, say, by saying that a single minute comprises an experiment, hence a total of 480 trials, we get a different values for  and , which would clearly impact our calculation of .",0,0,0,0,1,0,0,1
MLE and KL Divergence,"We will revisit JSD in the future when we discuss the mathematics behind GANs. But for now, it suffices to know what KL divergence is and what it measures. Now that we have reviewed the essential concepts that we need, let’s get down to the proof. Let’s start with the statement of the parameter  that minimizes the KL divergence between the two distribution  and the approximate distribution : Not a lot has happened in this step, except for substituting the  expression with its definition as per (2). Observe that in the last derived expression in (4), the term  does not affect the argument of the minima, which is why it can safely be omitted to yield the following simplified expression: We can change the argument of the minima operator to the maxima given the negative sign in the expression for the expected value. To proceed further, it is necessary to resort to the Law of Large Numbers, or LLN for short. The law states that the average of samples obtained from a large number of repeated trials should be close to the expected value of that random variable. In other words, the average will approximate the expected value as more trials are performed. More formally, LLN might be stated in the following fashion. Suppose we perform an experiment involving the random variable  and repeat it  times. Then, we would obtain a set of indecent and identically distributed (i.i.",0,0,0,0,1,0,0,0
Wonders of Monte Carlo,"Notice that there is a 100-step cap, meaning if the drunkard was not able to find the restroom after a hundred steps, the trial was assumed a failure. We can verify the functionality of our design by calling the function. Cool! The Monte Carlo algorithm thus tells us that the probability of success is about 10 percent, which is a lot smaller thant I had personally anticipated. Think about how complicated it would have been to calculate this probability by hand. By simulating this game multiple times and counting the instances of successes, we can derive an estimation of the success rate of our particular random walk model. Let’s see what happens when we simulate the drunkard’s walk thirty times. In the particular instance that I have below, we see that the drunkard successfully reached the rest room four out of thirty attempts, which roughly equals the success probability of ten percent we saw earlier.  By now, hopefully you have been convinced that Monte Carlo is a wonderful method of solving problems. Although the examples we looked at were mostly simple, these algorithms can easily be applied to solve much harder ones. Simply put, Monte Carlo uses a brute force approach to simulate a particular instance of a model multiple times. Through such repeated sampling, we are able to gain a better understanding of the parameters underlying the issue at hand, no matter how complex. This is a pattern that we saw with all three tasks we dealt with in today’s post.",0,0,0,0,1,0,0,0
Riemann Zeta and Prime Numbers,"The other day, I came across an interesting article by Chris Henson on the relationship between the Riemann Zeta function and prime numbers. After encountering a similar post on the math Stack Exchange, I thought I’d write an article on the same topic as well, perhaps as sort of a prologue to a previous article posted on this blog, Basel, Zeta, and some more Euler. The code introduced in this blog are adaptations of those written by Chris Henson, so all credits go to the original author. With that said, let’s dive right into it. The Riemann Zeta function is perhaps one of the most deeply studied functions in all of modern mathematics. It is sometimes also referred to as the Euler-Riemann Zeta function, but I will not adhere to this convention not only because it is needlessly long and cumbersome, but also because Euler already has so many constants and functions and theorems bearing his name. Anyhow, the Riemann Zeta function looks as follows: While there are so many layers to explore with this function, one relatively simple and interesting route is to factorize this function. We performed this factorization in the previous post while introducing Euler’s infinite product representation of the Zeta function. Let’s go through this step again, as it is pivotal for our segue into the topic of prime numbers and probability.",0,0,0,0,0,0,1,0
Understanding the  Leibniz Rule,"As simple as it seems, we can in fact analyze Leibniz’s rule by applying this definition, as shown below: Thus we have shown that, if the limits of integration are constants, we can switch the order of integration and differentiation. But because our quench for knowledge is insatiable, let’s consider the more general case as well: when the limits are not bounded by constant, but rather functions. Specifically, the case we will consider looks as follows. In this case, we see that  and  are each functions of variable . With some thinking, it is not difficult to convince ourselves that this will indeed introduce some complications that require modifications to our original analysis. Now, not only are we slightly moving the graph of  in the  axis, we are also shifting the limits of integration such that there is a horizontal shift of the area box in the  axis. But fear not, let’s apply the same approach to answer this question. This may appear to be a lot of computation, but all we’ve done is just separating out the integrals while paying attention to the domains of integration. Let’s continue by doing the same for the remaining terms. The first two terms in the limit go away since  goes to zero. While the same applies to the fractional terms, one difference is that they are also divided by , which is why they remain. We have simplified quite a bit, but we still have two terms in the limit expression that we’d like to remove.",0,0,0,0,0,0,1,0
An Introduction to Markov Chain Monte Carlo,"We covered the topic of Markov chains on two posts, one on PageRank and the other on the game of chutes and ladders. Nonetheless, some recap would be of help. [Wikepedia] defines Markov chains as follows: A Markov chain is a stochastic model describing a sequence of possible events in which the probability of each event depends only on the state attained in the previous event. In other words, a Markov chain is a method of generating a sequence of random variables where the current value of that random variable probabilistically dpends on its prior value. By recursion, this means that the next value of that random variable only depends on its current state. To put this into context, we used Markovian analysis to assess the probability that a user on the internet would move to one site to another in the context of analyzing Google’s PageRank algorithm. Markov chains also popped up when we dealt with chutes and ladders, since the next position of the player in game only depends on their current position on the game board. These examples all demonstrate the Markov property, also known as memorylessness. Later on, we will see how Markov chains come in handy when we decide to “jump” from one number to the next when sampling from the posterior distribution to derive an approximation of the parameter of interest. We also explored Monte Carlo in some detail here on this blog.",1,0,0,0,0,0,0,0
VGG PyTorch Implementation,"In today’s post, we will be taking a quick look at the VGG model and how to implement one using PyTorch. This is going to be a short post since the VGG architecture itself isn’t too complicated: it’s just a heavily stacked CNN. Nonetheless, I thought it would be an interesting challenge. Full disclosure that I wrote the code after having gone through Aladdin Persson’s wonderful tutorial video. He also has a host of other PyTorch-related vidoes that I found really helpful and informative. Having said that, let’s jump right in. We first import the necessary  modules. Let’s first take a look at what the VGG architecture looks like. Shown below is a table from the VGG paper.  We see that there are a number of different configurations. These configurations typically go by the name of VGG 11, VGG 13, VGG 16, and VGG 19, where the suffix numbers come from the number of layers. Each value of the dictionary below encodes the architecture information for each model. The integer elements represents the out channel of each layer.  represents a max pool layer. You will quickly see that the dictionary is just a simple representation of the tabular information above. Now it’s time to build the class that, given some architecture encoding as shown above, can produce a PyTorch model. The basic idea behind this is that we can make use of iteration to loop through each element of the model architecture in list encoding and stack convolutional layers to form a sub-unit of the network.",0,0,1,0,0,0,0,0
Traveling Salesman Problem with Genetic Algorithms,"Considering the fact that there are a total of  possibilities, the fact that the algorithm was able to narrow it down to a plausible route that beats the baseline is still very interesting. Genetic algorithms belong to a larger group of algorithms known as randomized algorithms. Prior to learning about genetic algorithms, the word “randomized algorithms” seemed more like a mysterious black box. After all, how can an algorithm find an answer to a problem using pseudo-random number generators, for instance? This post was a great opportunity to think more about this naive question through a concrete example. Moreover, it was also interesting to think about the traveling salesman problem, which is a problem that appears so simple and easy, belying the true level of difficulty under the surface. There are many other ways to approach TSP, and genetic algorithms are just one of the many approaches we can take. It is also not the most effective way, as iterating over generations and generations can often take a lot of time. The contrived semi-circle example, for instance, took somewhere around five to ten minutes to fully run on my 13-inch MacBook Pro. Nonetheless, I think it is an interesting way well worth the time and effort spent on implementation. I hope you’ve enjoyed reading this post. Catch you up in the next one!.",1,0,0,0,0,0,0,0
Logistic Regression Model from Scratch,"We see that accuracy spikes up on the first 20- epochs or so and quite quickly converges to about 90 percent. Past a certain threshold, the model seems to hover consistently at around the high 90s range, but accuracy still continues to increase ever so slightly with each epoch, though not as quickly as before. If we set the learning rate  to a smaller number, we would expect the model to take a lot longer to tune, and indeed this seems to be true:  With a much smaller learning rate, the model seems to struggle to achieve high accuracy. However, although there are a lot of uneven spikes, the model still manages to reach a pretty high accuracy score by 200 epochs. This tells us that the success of model training depends a lot on how we set the learning rate; setting an excessively high value for the learning rate might result in overshooting, while a low learning rate might prevent the model from quickly learning from the data and making meaningful progress. Accuracy helps us intuitively understand how well our model is doing, but recall that the main objective of gradient descent is not to maximize accuracy, but to minimize the cross entropy loss function. Therefore, perhaps it makes more sense to evaluate the performance of our logistic regression model by plotting cross entropy. Presented below is a simple function that plots epoch versus cross entropy given a list of learning rates, . Let’s plot cross entropy loss for three different values of : 0.",1,0,0,0,0,1,0,0
A sneak peek at Bayesian Inference,"We can see this in practice by reapplying Bayes’ theorem with updated information, as shown below: We see that the value of the conditional probability has indeed increased, lending credence to the idea that the man is sick. Like this, Like this, Bayes’ theorem is a powerful tool that can be used to calculate conditional probabilities and to update them continuously through repeated trials. From a Bayesian perspective, we begin with some expectation, or prior probability, that an event will occur. We then update this prior probability by computing conditional probabilities with new information obtained for each trial, the result of which yields a posterior probability. This posterior probability can then be used as a new prior probability for subsequent analysis. In this light, Bayesian statistics offers a new way to compute new information and update our beliefs about an event in probabilistic terms. Bayesian inference is nothing more than an extension of Bayes’ theorem. The biggest difference between the two is that Bayesian inference mainly deals with probability distributions instead of point probabilities. The case of the potential patient we analyzed above was a simple yet illuminating example, but it was limiting in that we assumed all parameters to be simple constants, such as  for test accuracy and  for false positive frequency. In reality, most statistical estimates exist as probability distributions since there are limitations to our ability to measure and survey data from the population.",0,0,0,0,1,0,0,1
Convex Combinations and MAP,"Recall the formula for the univariate Gaussian that describes our data: Then, from (1), we know that the likelihood function is simply going to be a product of the univariate Gaussian distribution. More specifically, the log likelihood is going to be the sum of the logs of the Gaussian probability distribution function. There is the log likelihood function! All we need now is the log prior. Recall that the prior is a normal distribution centered around mean  with standard deviation of 1. In PDF terms, this translates to The log prior can simply be derived by casting the logarithmic function to the probability distribution function. Now we are ready to enter the maximization step of the sequence. To calculate the maximum of the posterior distribution, we need to derive the posterior and set the gradient equal to zero. For a more robust analysis, it would be required to show that the second derivative is smaller than 0, which is indeed true in this case. However, for the sake of simplicity of demonstration, we skip that process and move directly to calculating the gradient. Let’s rearrange the final equality in (7). From (8), we can finally derive an expression for . This value of the parameter is one that which maximizes the posterior distribution.",0,0,0,0,1,0,0,0
k-Nearest Neighbors Algorithm from Scratch,"First, we enumerate thorugh the data set to calculate all the distances between the given test instance and the data points in the data set. Next, we sort the list. The returned result is a list that contains the indices of the  nearest neighbors the algorithm found in the data set. Note that we use the  function we wrote above. Let’s see if the code works by testing it on our toy data. The task is to find 5 data points that are closest to the first row of . As expected, the returned list contains the indices of the data points in  that are closest to . We can confirm this by looking at the results of the distance calculation we obtained when testing the  function. Note that the indices are in order; that is, indice 0 corresponds to the closet neighbor—it is in fact that data point itself—and index 2 refers to the farthest neighbor among the  selections. Say we have successfully obtained the list of  nearest neighbors. Now what? Well, it’s time to look up the labels of these neighboring data points to see which class is the most prevalent. The KNN model will then conclude that the most prevalent class label is the one that which the data point belongs to.",1,0,0,0,0,1,0,0
MLE and KL Divergence,"d, which is the assumption that we make to build models such as naïve Bayes, and so on. For now, it suffices to clarify that the goal of maximum likelihood estimation is to find the optimal parameter of a distribution that best captures some given data. KL divergence is a concept that arises from the field of information theory that is also heavily applied in statistics and machine learning. KL divergence is particularly useful because it can be used to measure the dissimilarity between to probability distributions. The familiar equation for KL divergence goes as follows: In Bayesian terms, KL divergence might be used to compare the prior and the posterior distribution, where  represents the posterior and , the prior. In machine learning,  is often the true distribution which we seek to model, and  is the approximation of that true distribution, which is also the prediction generated by the model. Note that KL divergence is not a true measure of distance, since it is asymmetric. In other words, The focus of this post is obviously not on distance metrics, and I plan on writing a separate post devoted to this topic. But as a preview of what is to come, here is an appetizer to get you interested. An alternative to KL divergence that satisfies the condition of symmetry is the Jensen-Shannon Divergence, which is defined as follows: where One can intuit JSD as being a measurement that somewhat averages the two asymmetric quantities of KL divergence.",0,0,0,0,1,0,0,0
A sneak peek at Bayesian Inference,"a head-biased coin; a larger , a tail-oriented one. When  and  take the same value, the local extrema of the Beta distribution is established at , when the coin is perfectly fair. Now that we have established the usability of the Beta function as a conjugate prior to the binomial likelihood function, let’s finally see Bayesian inference at work. Recall the simplified version of Bayes’ theorem for inference, given as follows: For the prior and the likelihood, we can now plug in the equations corresponding to each distribution to generate a new posterior. Notice that , which stands for data, is now given in the form  where  denotes the number of heads; , the total number of coin flips. Notice also that constants, such as the combinatorial expression or the reciprocal of the Beta function, can be dropped since we are only establishing a proportional relationship between the left and right hand sides. Further simplifications can be applied: But notice that this expression for the posterior can be encapsulated as a Beta distribution since Therefore, we started from a prior of  to end up with a posterior of . This is an incredibly powerful mechanism of updating our beliefs based on presented data. This process also proves that, as purported earlier, the Beta distribution is indeed a conjugate prior of a binomial likelihood function. Now, it’s time to put our theory to the test with concrete numbers. Suppose we start our experiment with completely no expectation as to the fairness of the coin.",0,0,0,0,1,0,0,1
Likelihood and Probability,"This code block creates two distributions of different parameters,  and . Then, we assume that a sample of value 1 is observed. Then, we can compare the likelihood of the two parameters given this data by comparing the probability density of the data for each of the two distributions. In this case,  seems more likely, i.e. it better explains the data  since , which is larger than . To sum up, likelihood is something that we can say about a distribution, specifically the parameter of the distribution. On the other hand, probabilities are quantities that we ascribe to individual data. Although these two concepts are easy to conflate, and indeed there exists an important relationship between them explained by Bayes’ theorem, yet they should not be conflated in the world of mathematics. At the end of the day, both of them provide interesting ways to analyze the organic relationship between data and distributions. Maximum likelihood estimation, or MLE in short, is an important technique used in many subfields of statistics, most notably Bayesian statistics. As the name suggests, the goal of maximum likelihood estimation is to find the parameters of a distribution that maximizes the probability of observing some given data . In other words, we want to find the optimal way to fit a distribution to the data. As our intuition suggests, MLE quickly reduces into an optimization problem, the solution of which can be obtained through various means, such as Newton’s method or gradient descent.",0,0,0,0,1,0,0,0
Revisiting Basel with Fourier,"In the last post, we revisited the Riemann Zeta function, which we had briefly introduced in another previous post on Euler’s take on the famous Basel problem. It seems like math is my jam nowadays, so I decided to write another post on this topic—but this time, with some slightly different takes. In this post, we will explore an alternative way of solving the Basel problem using Fourier series expansion, and also discuss a alternative representations of the Basel problem in integral form. For the integral representations, I’m directly referencing Flammable Maths, a YouTube channel that I found both entertaining and informative. Let’s get started. First, let’s recall what the Basel problem is. The problem is quite simple: the goal is to obtain the value of an infinite series, namely This seems like an innocuous, straightforward problem. One can easily prove, for instance, the fact that this series converges using integral approximation. However, to obtain the value of this series is a lot more difficult than it appears—it is no coincidence that this problem remained unsolved for years until Euler came along. While there are many ways to solve this problem—Euler’s method, in particular, is one of the countless examples through which one can witness his amazing intuition and heuristic—but we will be using Fourier expansion to solve this problem, as it also provides a nice segue into the Dirichlet Eta function. We explored the topic of Fourier expansion in this previous post.",0,0,0,0,0,0,1,0
Building Neural Network From Scratch,"We don’t have to worry about the dimensionality of the bias since  supports broadcasting by default. Presented below is a visualization of our neural network, created using NN-SVG. Instead of cluttering the diagram by attempting to visualize all 64 neurons, I decided to simplify the picture by assuming that we have 16 neurons in each of the affine layers. But with the power of imagination, I’m sure it’s not so much difficult to see how the picture would change with 64 neurons.  Hopefully the visualization gave you a better understanding of what our model looks like. Now that we have a function that creates our model, we are ready to run the model! At this point, our neural network model is only a dictionary that contains matrices of specified sizes, each containing randomly genereated numbers. You might be wondering how a dictionary can be considered a model—after all, a dictionary is merely a data structure, and so is incapable of performing any operations. To make our model to work, therefore, we need a function that performs matrix multiplications and applies activation functions based on the dictionary. The  function is precisely such a function that uses the weights stored in our model to return both the intermediary and final outputs, denoted as  and  respectively.  Note that we apply activation functions, such as  and  when appropriate. This process of deriving an output from an input using a neural network is known as forward propagation.",1,1,1,0,0,0,0,0
